{
  "$schema": "https://json-schema.org/draft/2020-12/schema",
  "$id": "tour-guide-place.schema.json",
  "title": "Tour Guide Place (data contract v1)",
  "description": "A candidate place for a trip. No Google content here (no hours, no coordinates): those come from the GoogleSnapshot for place_id.",
  "type": "object",
  "additionalProperties": false,
  "required": ["v", "id", "place_id", "name", "category", "tags", "status", "activity", "priority"],
  "properties": {
    "v": { "const": 1 },
    "id": { "type": "string", "pattern": "^[a-z0-9][a-z0-9-]{0,63}$", "description": "The local place key (also the brochure's place key)." },
    "place_id": { "type": "string", "pattern": "^[A-Za-z0-9_-]{6,300}$", "description": "A Google place id." },
    "name": { "type": "string", "minLength": 1, "maxLength": 120 },
    "category": { "type": "string", "pattern": "^[a-z][a-z0-9-]{0,31}$", "description": "museum, gallery, viewpoint, market, hike, park, garden, temple, shrine, church, experience (a set-length session: a ceremony, a class), neighbourhood, restaurant, cafe, bar, shop, other…" },
    "tags": { "type": "array", "maxItems": 20, "items": { "type": "string", "minLength": 1, "maxLength": 40 } },
    "why_fit": { "type": "string", "maxLength": 1000 },
    "source_trip": { "type": "string", "pattern": "^[a-z0-9][a-z0-9-]{0,63}$", "description": "The first trip the place was researched for." },
    "destination": { "type": "string", "pattern": "^[a-z0-9][a-z0-9-]{0,63}$", "description": "The trip destination slug the place belongs to (the places repository's key with the id)." },
    "history": {
      "type": "array",
      "maxItems": 200,
      "description": "One entry per trip and event, oldest first: the places repository's memory of what happened to this place.",
      "items": {
        "type": "object",
        "additionalProperties": false,
        "required": ["trip", "on", "event"],
        "properties": {
          "trip": { "type": "string", "pattern": "^[a-z0-9][a-z0-9-]{0,63}$" },
          "on": { "type": "string", "pattern": "^\\d{4}-(0[1-9]|1[0-2])-(0[1-9]|[12]\\d|3[01])$" },
          "event": { "enum": ["shortlisted", "chosen", "later", "skipped", "scheduled", "visited", "rated_up", "rated_down", "checked"] },
          "note": { "type": "string", "maxLength": 120 }
        }
      }
    },
    "last_researched": { "type": "string", "pattern": "^\\d{4}-(0[1-9]|1[0-2])-(0[1-9]|[12]\\d|3[01])$", "description": "When our own research claims were last refreshed." },
    "last_verified": { "type": "string", "pattern": "^\\d{4}-(0[1-9]|1[0-2])-(0[1-9]|[12]\\d|3[01])$", "description": "When the place was last checked open (a PlaceCheck)." },
    "status": { "enum": ["candidate", "chosen", "scheduled", "saved-for-later", "rejected"], "description": "chosen = the owner picked it from a shortlist; the planner turns it into scheduled or saved-for-later." },
    "note_path": { "type": "string", "maxLength": 300, "pattern": "^[^\\s].*$" },
    "activity": { "type": "string", "minLength": 1, "maxLength": 120 },
    "priority": { "enum": [1, 2, 3] },
    "booking": {
      "type": "object",
      "additionalProperties": false,
      "required": ["date", "time"],
      "properties": {
        "date": { "type": "string", "pattern": "^\\d{4}-(0[1-9]|1[0-2])-(0[1-9]|[12]\\d|3[01])$" },
        "time": { "type": "string", "pattern": "^([01]\\d|2[0-3]):[0-5]\\d$", "description": "The stop must start at this time." },
        "ref": { "type": "string", "maxLength": 120 },
        "minutes": { "type": "integer", "minimum": 15, "maximum": 720, "description": "The booked length (a ceremony, a class): the planner books exactly this long." }
      }
    },
    "indoor": { "type": "boolean" },
    "opening_days": { "enum": ["irregular"], "description": "The place opens on irregular days (a festival calendar, by appointment, seasonal): the planner keeps it in the plan, within any hours Google knows, and marks the stop check_on_day." },
    "opening_note": { "type": "string", "minLength": 1, "maxLength": 160, "description": "A short note on the irregular opening days, shown as the stop's check_on_day line." },
    "scheduled_hint": {
      "type": "object",
      "additionalProperties": false,
      "required": ["date"],
      "description": "Set by later/promote(): the owner asked for this place on that date; the planner re-plans that day.",
      "properties": { "date": { "type": "string", "pattern": "^\\d{4}-(0[1-9]|1[0-2])-(0[1-9]|[12]\\d|3[01])$" } }
    },
    "gem_score": { "type": "number", "minimum": 0, "maximum": 100, "description": "Gem Funnel score (written by gems/)." },
    "gem": { "type": "boolean", "description": "Marked 💎 by the Gem Funnel rule." },
    "obscurity": { "type": "number", "minimum": 0, "maximum": 1 },
    "local_mentions": {
      "type": "array",
      "maxItems": 20,
      "items": {
        "type": "object",
        "additionalProperties": false,
        "required": ["ref", "language", "kind"],
        "properties": {
          "ref": { "type": "string", "minLength": 1, "maxLength": 120, "description": "A research-kit ledger ref." },
          "language": { "type": "string", "pattern": "^[a-z]{2,3}(-[A-Za-z0-9]{2,8})*$" },
          "kind": { "enum": ["editorial", "community", "local-language"] },
          "publisher": { "type": "string", "minLength": 1, "maxLength": 120, "description": "The mention's publisher / host (research-kit mentions() row); mentions from one publisher count once." }
        }
      }
    },
    "flags": { "type": "array", "maxItems": 5, "items": { "enum": ["unproven", "tourist_oriented", "closed_day_conflict"] } }
  }
}
